library/src/amd_detail/rocblaslt/src/Tensile/Logic/asm_full/aquavanjaram/gfx942/Equality/aquavanjaram_Cijk_Ailk_Bljk_HF8_HHS_BH_Custom.yaml
- {MinimumRequiredVersion: 4.33.0}
- aquavanjaram
- gfx942
- [Device 0049]
    SolutionIndex: 0 #
    SolutionNameMin: Cijk_Ailk_Bljk_HHS_BH_MT32x16x128_MI16x16x1_SN_GSU8_MIWT1_1_NT0_NTA0_NTB0_NTC0_NTD0_NTM0_SU0_SUS0_WSGRA1_WSGRB1_WGM110
    SolutionIndex: 1 #
    SolutionNameMin: Cijk_Ailk_Bljk_HF8_HHS_BH_MT32x16x128_MI16x16x1_SN_GSU19_LBSPPA256_LBSPPB256_MIWT1_1_NEPBS16_SPO1_SSO0_WG32_4_1
    SolutionIndex: 2 #
    SolutionNameMin: Cijk_Ailk_Bljk_HF8_HHS_BH_MT32x16x128_MI16x16x1_SN_GSU64_LBSPPA256_LBSPPB256_MIWT1_1_NEPBS0_SPO1_SSO2_WG32_4_1
    SolutionIndex: 3 #
    SolutionNameMin: Cijk_Ailk_Bljk_HF8_HHS_BH_MT16x128x128_MI16x16x1_SN_LDSB1_GRVWA8_GSU8_LBSPPB256_MIWT1_2_NTB0_NEPBS0_SPO1_SSO0_WG16_16_1
    SolutionIndex: 4 #
    SolutionNameMin: Cijk_Ailk_Bljk_HF8_HHS_BH_MT16x64x128_MI16x16x1_SN_LDSB0_GRVWA8_GSU8_LBSPPB256_MIWT1_1_NTB0_NEPBS16_SPO1_SSO2_WG16_16_1
    SolutionIndex: 5 #
    SolutionNameMin: Cijk_Ailk_Bljk_HF8_HHS_BH_MT16x128x128_MI16x16x1_SN_LDSB1_GRVWA8_GSU9_LBSPPB256_MIWT1_2_NTB0_NEPBS0_SPO0_SSO0_WG16_16_1
    SolutionIndex: 6 #
    SolutionNameMin: Cijk_Ailk_Bljk_HF8_HHS_BH_MT256x16x64_MI16x16x1_SN_LDSB1_GRVWB4_GSU9_LBSPPA2048_LBSPPB128_MIWT4_1_NTA0_NEPBS0_NLCA1_SPO0_SSO0_SVW4_VWA4_WG64_4_1
    SolutionIndex: 7 #
    SolutionNameMin: Cijk_Ailk_Bljk_HF8_HHS_BH_MT64x16x128_MI16x16x1_SN_LDSB0_GRVWB4_GSU7_LBSPPA512_LBSPPB256_MIWT1_1_NTA1_NEPBS16_NLCA1_SPO1_SSO0_SVW1_VWA1_WG64_4_1
    SolutionIndex: 8 #
    SolutionNameMin: Cijk_Ailk_Bljk_HF8_HHS_BH_MT256x16x32_MI16x16x1_SN_LDSB1_GRVWB2_GSU7_LBSPPA2048_LBSPPB128_MIWT4_1_NTA1_NEPBS16_NLCA1_SPO0_SSO2_SVW4_VWA4_WG64_4_1
    SolutionIndex: 9 #
    SolutionNameMin: Cijk_Ailk_Bljk_HHS_BH_MT64x16x64_MI16x16x1_SN_GRVWB4_GSU7_LBSPPA512_LPB4_LRVW4_LWPM0p45_MIWT1_1_NTA0_NEPBS0_SPO0_SSO0_SVW1_VWA1_WG64_4_1
    SolutionIndex: 10
    SolutionNameMin: Cijk_Ailk_Bljk_HHS_BH_MT128x16x32_MI16x16x1_SN_LDSB0_GSU9_MIWT2_1_NEPBS16_SU0_SUS0_WSGRA1_WSGRB1_WGM1
    SolutionIndex: 11 #
    SolutionNameMin: Cijk_Ailk_Bljk_HHS_BH_MT16x128x128_MI16x16x1_SN_LDSB1_GSU9_LBSPPB256_LWPM0p40_MIWT1_4_NTB1_NEPBS16_SPO1_SSO2_WSGRB1_WG16_8_1
- - - [16, 16, 1, 1024]
    # - [37, 0.0]
    - [0, 0.0]
  - - [16, 16, 1, 8192]
    # - [41, 0.0]
    - [1, 0.0]
  - - [16, 16, 1, 65536]
    # - [42, 0.0]
    - [2, 0.0]
  # - - [16, 2048, 1, 1024]
  #   - [38, 0.0]
  - - [16, 2048, 1, 8192]
    # - [43, 0.0]
    - [3, 0.0]
  - - [16, 2048, 1, 65536]
    # - [44, 0.0]
    - [4, 0.0]
  # - - [16, 8192, 1, 1024]
  #   - [45, 0.0]
  # - - [16, 8192, 1, 8192]
  #   - [46, 0.0]
  - - [16, 8192, 1, 65536]
    # - [47, 0.0]
    # # - [66, 0.0]
    - [5, 0.0]
    # - [11, 0.0]
  # - - [2048, 16, 1, 1024]
  #   - [48, 0.0]
  - - [2048, 16, 1, 8192]
    # - [49, 0.0]
    # # - [64, 0.0]
    # - [6, 0.0]
    - [9, 0.0]
  - - [2048, 16, 1, 65536]
    # - [50, 0.0]
    - [7, 0.0]
  # - - [2048, 2048, 1, 1024]
  #   - [54, 0.0]
  # - - [2048, 2048, 1, 8192]
  #   - [55, 0.0]
  # - - [2048, 2048, 1, 65536]
  #   - [56, 0.0]
  # - - [2048, 8192, 1, 1024]
  #   - [57, 0.0]
  # - - [2048, 8192, 1, 8192]
  #   - [58, 0.0]
  # - - [2048, 8192, 1, 65536]
  #   - [59, 0.0]
  # - - [8192, 16, 1, 1024]
  #   - [51, 0.0]
  # - - [8192, 16, 1, 8192]
  #   - [52, 0.0]
  - - [8192, 16, 1, 65536]
    # - [53, 0.0]
    # # - [65, 0.0]
    - [8, 0.0]
    # - [10, 0.0]
  # - - [8192, 2048, 1, 1024]
  #   - [40, 0.0]
  # - - [8192, 2048, 1, 8192]
  #   - [60, 0.0]
  # - - [8192, 2048, 1, 65536]
  #   - [39, 0.0]
  # - - [8192, 8192, 1, 1024]
  #   - [61, 0.0]
  # - - [8192, 8192, 1, 8192]
  #   - [62, 0.0]
  # - - [8192, 8192, 1, 65536]
  #   - [63, 0.0]
- null
- null
- DeviceEfficiency
- null
- Equality
